index,name,release_date,summary,meta_score,user_review
2225,Lego Star Wars II: The Original Trilogy,2006-09-12,"Lego Star Wars II takes the fun and customization ability of the LEGO play pattern and combines it with the epic story, characters and action from the revolutionary Star Wars: Episodes IV, V and VI. With a unique tongue-in-cheek take on the Original Trilogy, LEGO Star Wars II lets you build and battle your way through your favorite film moments. From Darth Vader's pursuit of Princess Leia aboard her Blockade Runner to Luke's final confrontation with Emperor Palpatine. For the first time ever, characters can get in and out of vehicles, as well as ride creatures. Because it's LEGO style, you can also mix and match the body parts of more than 50 playable characters to create one of millions of possible LEGO Star Wars heroes. And on PS2, Xbox and Windows platforms, a game save from the first LEGO Star Wars can unlock another 50-plus additional characters for Free Play mode -- that's more than 100 total characters. Other exciting additions include free-roaming vehicle levels, the ability to switch ships at will in Free Play mode, cool new character-specific attacks and maneuvers, playable mini-kit vehicles, an adaptive difficulty option and more.",84,8.7
2385,NBA Live 2005,2004-09-28,"Elevate your game on both ends of the court with NBA Live 2005. Create new dribble moves, flashy dunks, and tenacious defensive plays that express your individual style--all with a touch of the right analog stick. The new 10-man Freestyle implementation enhances individual player movements and floor spacing, putting you in the middle of the action. Enhanced player graphics reproduce NBA players with realistic faces, hairstyles, jerseys, and shoes. NBA Live 2005 also offers a deeper Dynasty mode, where you can watch your franchise flourish for 25 seasons.",83,7.1
2386,Resident Evil 0,2002-11-10,"Before the events of Resident Evil, the residents of Raccoon City lived their lives unaware of the dark fate that surrounded them. Now, along with your S.T.A.R.S. Bravo Team, you're sent in to investigate a series of grisly murders in the area. As Rebecca Chambers, a rookie cop, or Billy Cowen, an escaped convict, you'll fight zombies, solve challenging puzzles, and slowly uncover the truth behind the murders. A new Partner Zapping System lets you quickly switch between each character.",83,8.6
2440,FIFA Soccer 2004,2003-11-04,"FIFA Soccer kicks its game up a few notches with new installment, FIFA Soccer 2004. This year's action features more advanced levels of player detail and responsiveness. Play as one of the best players from 16 leagues and 350 teams, from Europe's super leagues to the Americas. Plus, a new Career Mode gives you the chance to take a team from the lower divisions, battle through ranks, sign new players, and turn them into champions. With immersive atmospheres, total realism with the world's premier clubs, and improved gameplay, FIFA Soccer 2004 looks to reach the goals of soccer fans.",83,6.3
2536,Freedom Fighters,2003-10-01,"With fierce conflict unfolding in the streets of America, it's your patriotic duty to fight back. Take on the role of Christopher Stone, and evolve from an average New Yorker into a fearless patriot who recruits and leads an army of freedom fighters in the streets of New York City. Freedom Fighters combines the depth of a squad-based game with the intensity of an action-packed war game, all of which unfolds in the streets, subways, and buildings of a modern-day urban battleground.",83,7.7
2628,Hitman 2: Silent Assassin,2003-06-19,"The sequel to Hitman forces a retired assassin back into action by treason. Visit the dark recesses of the world corrupted by crime, greed, degradation, and dishonor. Your contracts will take you to exotic locations around the globe including Sicily, St. Petersburg, Japan, Malaysia, and India. A diverse arsenal of equipment, from armor-piercing rifles and explosives to chloroform and poison darts, are at your disposal. Stalk and eliminate your targets up close and personal, in either first- or third-person perspectives. You must decide whether to use stealth or aggression, but be careful--you'll have to deal with the consequences.",83,6.9
2638,Prince of Persia: Warrior Within,2004-11-30,"Hunted by Dahaka, an immortal incarnation of Fate seeking divine retribution, the Prince embarks on a new journey on a cursed island. Only with courage and the mastery of new combat arts can the Prince emerge victoriously. As the Prince, you can develop your own fighting style by manipulating the environment and the enemies. You can even use new projectile attacks and Sands of Time powers to rid the lands of deadly monsters.",83,8
2679,XGIII: Extreme G Racing,2001-11-27,"High-speed motorcycle racing and high-stakes futuristic combat collide in X63--an intoxicating, highly addictive arcade experience. Feel every razor sharp turn and roller-coaster drop in the pit of your stomach as you smash through the sound barrier at speeds over 750 mph.",83,7.8
2819,Harvest Moon: Magical Melody,2006-03-28,"Harvest Moon: Magical Melody features plenty of crops, a variety of animals to care for, tons of festivals to participate in and loads of events to create a fun and entertaining game play experience. Play as either a boy or girl: Each gender has 10 potential spouses. Compete against a rival farmer; Your productivity will be judged on a daily basis against that of your rival's...you will also compete against your rival in the festivals. Cultivate a wide variety of crops and trees. Raise cows, sheep, horses and chickens. Harvest Moon: Magical Melody offers 4-player minigames. Purchase different plots of land and expand your farm by building various extensions. The Harvest Goddess has turned to stone and the Harvest Sprites need your help to bring her back. You need to collect Musical Notes throughout the game in hopes of restoring her to her former self. There are 100 Musical Notes in the game and to collect the notes you must do a variety of different tasks, such as shipping a certain number of items, winning a festival or making friends with the wild animals found around your farm. Only by collecting a certain number of notes will the Harvest Goddess come back.",83,8.8
2835,Metal Arms: Glitch in the System,2003-11-18,"Blast your way to victory as Glitch, the gun-slinging, half-ton menacing bot of Droid City. Found as scrap metal, but transformed into destructive machinery, Glitch is determined to free his people from the evil clutches of General Corrosive and his maniacal army of Mil bots. As you venture through 40 missions, you'll find 17 deadly weapons, a variety of vehicles, and enemy bots that you can control. Annihilate the General's sinister plan to dominate the world and salvage the robot race.",83,8.5
2922,NHL Hitz 20-03,2002-09-16,"In the world of NHL Hitz 20-03, hard-checking and highlight-reel action is common. This year's installment in the action-packed NHL Hitz series showcases three-on-three gameplay with players who leap, glide, check, pass, and score on defenders. New features include a deeper New Season mode, player trades, a playoff tree, and official NHL awards. The game also boasts bigger, stronger, and faster players, plus improved goalie logic, behavior, animations, and control, making it tougher to score.",82,8.6
3012,Madden NFL 07,2006-08-22,"With the exclusive video game license of the NFL and its players, and currently in its 17th installment, Madden NFL 07 puts you in control the running game like never before. For the first time ever, step up as the lead blocker to create a hole, and then take control of the tailback and smash through, overpower, or slash away from would-be tacklers as you fight for every yard. Innovative rushing controls give you a game-breaking ground attack featuring all-new jukes, cutbacks, and the distinct running styles of your favorite backs.",82,7.8
3103,X-Men Legends II: Rise of Apocalypse,2005-09-20,"In X-Men Legends II, the X-Men must join their enemy the Brotherhood to fight a greater menace--Apocalypse. The sequel to the team-based role-playing game X-Men Legends lets you play as one of many X-Men, and use and combine his or her unique abilities to defeat enemies. Rise of Apocalypse includes new mutant powers, playable characters, and environments. Also new to X-Men Legends II is online play, which lets you work cooperatively against other teams of mutants.",82,6.4
3105,Gladius,2003-11-03,"The darkness of the Great War has passed, and the lands of Gladius are peaceful once more. Now combat takes place only in the gladiator arenas, where schools from around the world compete for the title of Imperial Champions. Follow the grand saga of two young heroes, Ursula and Valens, as they recruit and train a team of warriors and compete in the gladiator games. Battle with deadly weapons and powerful magic as you learn vital combat tactics and enhance your own characters.",82,7.9
3106,NCAA College Basketball 2K3,2002-12-02,"NCAA College Basketball returns for another year of tournaments, chants, and rivalries. More than 300 Division I teams have been updated with accurate rosters, ratings, and schedules. Select a team and compete in conference tournaments, or create your own custom tournament from scratch. As you move up the ranks, you'll discover each school has its own mix of cheerleaders, chants, and fight songs. Now you can invade home courts online against players nationwide on the Xbox and PlayStation 2.",82,
3145,Tiger Woods PGA Tour 06,2005-09-20,"Tiger Woods 06 pits you against Tiger Woods in a battle to be the best golfer of all time. You can play golf greats in their own eras on their terms to prove that you are the best ever. Tiger Woods 06 includes greater shot control and a ""gamebreaker"" meter that models the momentum of professional golf competition. You can play on 15 courses, both licensed and fantastical. ""Game face"" features return to let you customize a character and take him or her through an entire 52-week PGA season. Tiger Woods 06 also adds more multiplayer modes and capabilities.",82,5.8
3152,The Lord of the Rings: The Two Towers,2002-12-30,"The second chapter in the epic story of Middle-earth pits you against Sauron and the evil forces of Mordor. In The Lord of the Rings: The Two Towers, you'll battle an army of 10,000 Uruk-Hai on the walls of Helm's Deep, hordes of Orcs on the plains of Rohan, and even the monstrous Cave Troll in Balin's Tomb. Guide Aragorn, Gimli, or Legolas through 13 interactive environments, using each character's unique moves, skills, and weaponry to complete your quest.",82,8.4
3153,NBA Live 2003,2002-10-08,"Live your dream of NBA superstardom in NBA Live 2003. This year's installment in the NBA Live series features a new control system that lets you make quick steals, monster shot blocks, and smooth crossover dribbles. New animations show everything from power dunks and rebounds to signature moves and coaches' reactions. The game also features old NBA uniforms from basketball legends, such as Elgin Baylor, Jerry West, and Dr. J. Add to the mix fresh commentary and dialogue between player and coach, and you have a complete NBA experience.",82,8.2
3184,Star Fox Adventures,2002-09-22,"General Scales has unleashed powers that are tearing apart the once-peaceful Dinosaur Planet. With the survival of his home planet at risk, Fox McCloud receives an urgent message to battle Scales and his vast army of SharpClaws. As Fox, you'll gain support from Star Fox Team members Slippy, Peppy, and Rob. You must rely on the mystical powers of a unique staff as you battle Scales' minions, befriend peaceful plant-eaters, and encounter eerie spirits that hold the key to the planet's survival.",82,7.9
3230,TimeSplitters: Future Perfect,2005-03-21,"In TimeSplitters: Future Perfect, humanity is on the brink of destruction by the evil TimeSplitters. With the help of some familiar faces, Cortez--the tough hero from previous installments--must chase a mystery foe across different time periods to trace the origins of the TimeSplitters. As Cortez, you'll have access to weapons, gadgets, characters, and environments that are unique to each time period. You can also correct the mistakes made in the past or team up with past and future versions of yourself in battles.",82,8.6
3257,Tony Hawk's Underground 2,2004-10-04,"You've been chosen by Tony Hawk to compete against Bam Margera's team in the World Destruction Tour. In an all-new storyline, Tony Hawk's Underground 2 takes you to skateparks around the world, where you can spray your custom tag, slap stickers, and even create new skate lines. Now you can play as yourself, as your teammates, or as more than 20 special skaters. If you're feeling nostalgic for older Tony Hawk games, you can try Classic mode, which challenges you to accomplish your favorite goals, such as Secret Tape and High Score.",82,8.3
3417,Tom Clancy's Splinter Cell Chaos Theory,2005-03-31,"As Sam Fisher, Third Echelon's most skilled Splinter Cell operative, you are assigned to execute a hazardous series of operations to investigate and eliminate a new source of information attacks originating in North Korea. At your disposal is a lethal array of tactics ranging from Combat Knife techniques to experimental prototype weapons skills and more-radical hand-to-hand techniques such as the Inverted Chokehold. Experience the intensity of acting as a lone operative fighting tomorrow's threats in the field and of cooperating online with a partner to accomplish crucial missions.",81,8.1
3571,NFL Street,2004-01-13,"Get ready for a new brand of football meant only for the streets. NFL Street delivers hard-hitting, fast-paced 7-on-7 arcade football. Don't be afraid to add extra style to your bone-crushing tackles, passes and runs as you will be rewarded with superpowered Gamebreakers. Choose from more than 300 current NFL stars and legends such as Barry Sanders, and play through a variety of fields including a beach, a park or a corner lot. Get ready to rule the streets and look good doing it.",81,8.2
3521,FIFA Soccer 2002,2001-11-21,"As the first and only soccer game available for the GameCube, FIFA 2002 is an excellent start.",81,8.3
3580,Mario Golf: Toadstool Tour,2003-07-29,"Mario Golf: Toadstool Tour updates the Mario Golf series with more swing control, new courses, and fun side games. Carefully select your club, choose the optimal contact point and trajectory, compensate for wind and green speeds, and then swing away. You'll also have to compensate for each character's weaknesses and for each course's terrain--from beautiful rolling hills to fantastic pipes and sand traps. One to four players can enter a tournament, which rewards skillful play with trophies, badges, prizes, and secrets.",81,8.1
3626,Peter Jackson's King Kong: The Official Game of the Movie,2005-11-21,"Play as man or beast in Peter Jackson's King Kong: The Official Game of the Movie. You can be King Kong or Jack Driscoll as you follow a story based on the movie. Peter Jackson, the director of the 2005 movie, also took an active role in developing the game, which expands upon the movie's storyline, adding new creatures and locations. The game employs a cinematic style that makes the game more immersive and less like a traditional video game.",81,7.9
3633,The Sims Bustin' Out,2003-12-15,"The Sims are making a big return to the console and this time they are bustin' out of the house and exploring all-new locations around town. In The Sims Bustin' Out, players can choose from a variety of new career paths. Along the way, players can unlock and collect over a hundred of new objects and social moves exclusive to the console. Play, work, and socialize with a cast of over 25 new outrageous characters and climb through a dozen new careers. The Sims Bustin' Out also features new integrated two-player gameplay and memory card support, for those players who like to take their Sims over to a friend's house and show them off.",81,8.4
3934,NHL Hitz Pro,2003-09-25,"NHL Hitz Pro mixes a hard-hitting blend of NHL authenticity and adrenaline-style gameplay with real five-on-five NHL hockey. While huge hits and rocket goals are common, the games still follows all NHL penalties from offsides and two-line passing to holding and cross-checking. Choose from 23-man NHL player rosters to play in a variety of real stadiums. Practice your skills in the retooled Hockey School mode, and then build your own dynasty in Franchise mode. You can also play head-to-head online or set up a tournament for up to 16 teams.",81,8
3966,X-Men Legends,2004-09-21,"X-Men enter the realm of role-playing games with an intense story, superhero action, and multiplayer modes. The story in X-Men Legends begins when the X-Men learn that Magneto has devised a plan to give mutants the power to reign supreme over humans. To save the human race from imprisonment, you compose a four-person team from a roster of X-Men characters, including Storm, Gambit, and Wolverine. Complete each mission to strengthen your team, and unlock more characters, costumes, and treasures.",81,8.4
3978,Mortal Kombat: Deadly Alliance,2002-11-17,"A controversial franchise marks its return in Mortal Kombat: Deadly Alliance. This time around, the fighting game features an all-new fighting system, an in-depth, supernatural storyline, and the infamous brutal fatalities. Beginning the next chapter in the battle of good versus evil, two powerful sorcerers--Shang Tsung and Quan Chi--join forces to deliver unrivaled fighting action in their quest for supreme mortality. Use new or classic Mortal Kombat fighters and engage in hand-to-hand and special-weapon combat, executing secret moves and combinations for fatalities and deadly body blows.",81,8.6
3996,Def Jam Vendetta,2003-03-31,"It's been three years since D-Mob chased you out of the New York fight circuit and you swore you'd never go back. Now your pal Manny is in trouble, and he needs you to bail him out. Your only chance to get the money is to settle a score with the Def Jam crew, including DMX, Ludacris, Joe Budden, and Method Man. While listening to the tracks and beats from Def Jam artists, you can fight or play as over 40 combatants, each with special moves, combos, and taunts.",81,8.2
4005,Donkey Kong Jungle Beat,2005-03-14,"Feel the beat of an all-new Donkey Kong adventure as you drum your way through wild jungle kingdoms. In Donkey Kong Jungle Beat, you must use the DK Bongo Controller to guide the ape through dangerous environments rife with enemies and obstacles. Donkey Kong's actions, which include walking, jumping, and attacking, depend on where you hit both bongo drums. Use your hands to battle beasts, collect bananas, put together combo strings, box with rivals, and even ride animals.",80,8.2
4010,Mario Power Tennis,2004-11-08,"The popular N64 tennis game returns with even more powerful shots, new power-ups, and wild environments. Now you can join all your favorite characters from the Mushroom Kingdom--including Mario, Donkey Kong, Bowser, and Peach--on various courts inspired by Nintendo games. Each character has a special strength that you can use for both offense and defense. Build up your skill points in single-player challenges or practice your skills in four-player matches.",80,8.5
4108,FIFA 07 Soccer,2006-10-03,"FIFA 07 delivers complete authenticity with licenses for all the world's top leagues, including MLS and Mexican 1st Division in North America, and 26 others from over 20 nations. This year, you have the power to shape your club's destiny in the EA Sports Interactive Leagues, a new online mode that enables you to pit your club against supporters of your real-world opponents. The online interactive leagues feature the F.A. Premier League, Bundesliga, French League and the Mexican 1st Division. Experience the future of online gaming as you play your games according to the real-world schedule. When they play, you play. Track your team's progress as the aggregate results determine your club's position in the league table. This year, new intelligent A.I. ensures that your 11 men on the pitch make realistic decisions, finding space and passing like professionals. A complete overhaul of the game engine now means that you have to employ real world tactics, make split-second decisions and think like a player in order to win matches. Watch as your players jostle and collide realistically while trying to win balls. Experience the realism of the world's superstars, who come to life with signature moves and authentic playing styles and a more sophisticated shooting mechanic that gives you greater control to produce finesse shots. Plus you now have the ability to apply topspin or backspin to the ball for more creative set-pieces.",80,8.3
4126,SSX On Tour,2005-10-11,"You can ski or snowboard yourself into stardom in SSX On Tour. The game includes 12 levels for racing and performing stunts. You can earn yourself a spot on the professional tour by winning events and improving your skills. Your success moves you up the rankings until you can call yourself the best on the mountain. This version of SSX features new graphical effects and controller feedback designed to capture the speed of your races and the massive air of your tricks. SSX On Tour also includes new music, art, and characters.",80,7.6
4194,Baten Kaitos: Eternal Wings and the Lost Ocean,2004-11-16,"The story of Baten Kaitos: Eternal Wings and the Lost Ocean takes place in a time when lands exist in the sky and once vast oceans are mere legend among men. In the game, you'll control a spirit that guides Kalas throughout his journey and fights by his side. Collect more than 1,000 types of Magnus cards to help you fight, heal yourself, solve puzzles, and more. Get ready to unlock the mystery of the lost sea in a story of friendship, betrayal, and prayer.",80,8.2
4204,Final Fantasy Crystal Chronicles,2004-02-09,"The Final Fantasy series explodes onto the GameCube with action-packed multiplayer gameplay and an epic storyline seeped in Final Fantasy style and lore. Final Fantasy: Crystal Chronicles tells the tale of a land covered in poisonous miasma where people depend on precious crystals to stay alive. By using Game Boy Advance systems as controllers, four players can team up to solve puzzles, defeat enemies, and survive in a land teeming with danger. While much of the gameplay involves hacking and slashing through colorful monsters, Crystal Chronicles is all about teamwork.",80,8.9
4385,Karaoke Revolution Party,2005-11-08,"Now you can showcase your vocal skills in the next installment in Konami's singing series. Karaoke Revolution Party features 50 songs, new multiplayer and party modes, and EyeToy support.",80,
4449,Medal of Honor Frontline,2002-11-10,"Head back behind enemy lines with Lt. Jimmy Patterson in Medal of Honor Frontline. In this installment of the Medal of Honor series, Lt. Patterson is on a mission to infiltrate the German frontline and steal the HO-IX flying wing, an experimental Nazi weapon so powerful it could turn the tide of World War II. All 20 levels and six major missions in the game are based on real World War II events. You'll also find authentic weapons, including the Colt .45, Springfield sniper rifle, Panzerschreck rocket launcher, and Browning automatic rifle. The World War II experience just got more intense.",80,7.5
4463,All-Star Baseball 2004,2003-02-23,"Not only does All-Star Baseball 2004 simulate professional baseball, but it also gives you a look into baseball's history and homes. Now, in addition to today's baseball stars, you can play history's greatest players, from the MLB to the Negro Leagues. Take a panoramic tour of each stadium while learning about interesting facts and features. If you're new to the game, all-star Derek Jeter will guide and instruct you in the new Rookie mode tutorial.",80,8.2
4530,FIFA Soccer 06,2005-10-04,You can experience the excitement of international soccer competition in FIFA 06. Extensive coaching options give you the opportunity to take control of all of your players on the pitch and determine their formation and strategy. FIFA 06 offers game modes ranging from a tournament to individual skill games. You can also play with real players from famous international teams from around the world. Multiplayer modes let you challenge other gamers.,80,8.2
4544,James Bond 007: NightFire,2002-11-18,"The ultimate secret agent is back in his most dangerous adventure yet in James Bond 007: NightFire. Explore new heights and depths like never before--infiltrate towering skyscrapers, take on treacherous underwater missions, and maneuver your sleek Aston Martin V12 Vanquish through the streets of Tokyo. New state-of-the-art upgradeable gadgets and weapons and original missions--including zero-gravity assignments--will leave you shaken and stirred.",80,8.5
4546,Kelly Slater's Pro Surfer,2002-09-16,"Experience the rush of big-wave surfing and the surfer lifestyle as you search the globe for the world's best breaks. In Kelly Slater's Pro Surfer, you'll play Kelly Slater, or one of eight other surfers, in exotic locations with more than 30 challenging levels to explore. Drop down huge waves, ride barreling tubes, and pull off exciting trick combinations and signature pro moves. The game features multiple gameplay modes, including a Surf Trip where you choose your own path in search of the perfect wave.",80,8.2
4617,Need for Speed Most Wanted,2005-11-15,"In Need for Speed Most Wanted, you can try to become the most notorious street racer alive. Outrun both racers and cops to increase your reputation and move up the street racing blacklist. You can choose from a variety of vehicle types and destructible urban maps featuring shortcuts, traffic, and patrolling police.",80,8.7
