index,name,release_date,summary,meta_score,user_review
13863,Street Racing Syndicate,2004-08-31,"From fancy cars to beautiful import models, Street Racing Syndicate delivers the fast-paced world of street racing. You can race for money, pink slips, and more through the streets of LA, Philadelphia, and Miami. With each win, you'll earn cash, respect, and the affections of real-world street racing models. Use your cash to customize vehicles with licensed parts and graphic upgrades. Showcase your vehicle in online races, but be ready to drive off track if the police come.",64,8.3
13869,Pokemon XD: Gale of Darkness,2005-09-28,"Pokemon XD is a sequel to the role-playing game Pokmon Coliseum. You'll play as Michael, a Pokmon trainer who is trying to thwart the evil Cipher. Cipher plans to control the world by using the powerful, but unpredictable, shadow Pokmon. Now you must fight back by collecting your own shadow Pokmon and beating Cipher's goons in battle. Pokmon XD also lets you import Pokmon from Game Boy Advance Pokmon games and participate in head-to-head battles with other players.",64,8.2
13887,Scooby-Doo! Unmasked,2005-09-12,"In this action adventure platform game, players assume the role of Scooby-Doo as he and the teenage sleuths of Mystery Inc. visit Fred's cousin Jed, a monster movie set designer. They find Jed has disappeared and his animatronics are out of control, sending mechanical monsters haywire and making Jed the prime suspect. Players must stop the creepy costumed characters, unmask the truth and prove Jed's innocence. Scooby is able to don Kung Fu, bat and archer costumes so that he can karate chop, glide and aim plungers at monsters. The game consists of three sprawling worlds that each feature multiple levels and mini games with numerous cut scenes and climactic boss battles. Players recognize will the voice of the original Batman television series' Adam West as Winslow Stanton, the game's main villain, as well as authentic Scooby-Doo! cartoon voice actors. In addition, effects from the original cartoon, such as canned laughter and classic catch phrases, have been incorporated into the game.",64,6.8
14034,Egg Mania: Eggstreme Madness,2002-09-11,"In Egg Mania: Eggstreme Madness, you must build a tower from falling puzzle pieces to reach a balloon basket high above. Your tower must be strong and stable, or it will collapse on itself back into the water below. If that wasn't hard enough, you'll have opponents that will do anything to stop you--from throwing bombs and hammers to summoning clouds of lightning. This is a frenetic puzzle game that both young and old gamers can enjoy.",64,8
14082,WWE WrestleMania X8,2002-06-09,"Legendary battles and intense drama are packed into one event--WrestleMania, where the baddest men on the planet meet to become champions of wrestling. An updated 2002 roster features superstars and newcomers Rob Van Dam, Booker T, The Hurricane, and nWo members Scott Hall, Kevin Nash, and Hulk Hogan. Master each superstar's unique wrestling style and turn the tide of the match through a combination of counters, reversals, and brutal finishing moves. Now you can start from the beginning and take your rookie wrestler up through the ranks in quest for the Heavyweight Championship Belt.",64,6.9
14162,Hello Kitty: Roller Rescue,2005-08-16,"The lovable Sanrio character Hello Kitty has made her way onto the GameCube in a new adventure game. In Hello Kitty: Roller Rescue, you'll explore Hello Kitty's 3D world and encounter a variety of characters, villains, and puzzles. You'll interact with more than 20 Sanrio characters that can help you battle enemies.",64,7.1
14165,RoadKill,2003-10-30,"RoadKill presents an action-packed, mission-based combat driving experience. To survive, you must out-drive, outgun and outthink rival gangs, city guards, and anyone else gunning for you in the living, post-apocalyptic territory of Hell County. With the ability to build up a powerful gang following, you'll unleash havoc, chaos, and destruction on the environment and its inhabitants with a wide selection of vehicles, a potent armory of weapons, and special equipment in both single-player and various multiplayer game modes.",64,7.8
14243,Enter the Matrix,2003-05-14,"Enter the Matrix features awesome gunplay and spectacular martial arts that bend the rules of the Matrix, insane driving and stunts, and the chance to pilot the fastest hovercraft in the fleet. This game isn't just set in the Matrix universe--it's an integral part of the entire Matrix experience, with a story that weaves in and out of The Matrix: Reloaded, the second chapter of the movie trilogy. Enter the Matrix is the story behind the story.",63,8.1
14331,Batman: Rise of Sin Tzu,2003-11-11,"In Batman: Rise of Sin Tzu, Batman faces a new enemy unlike any he has ever faced before. The faceless foe plunges Gotham City into chaos on the night of the anniversary of Bruce Wayne's parents' murder. Who is responsible for unleashing havoc on Gotham City? The truth will be revealed after you battle evil forces and super-villains, including Bane, Clayface, Scarecrow, and the new formidable foe--Sin Tzu. In addition to Batman's martial arts attacks, Batman has an arsenal including the Batarang, Grappling Hook, and Smoke Bomb.",63,
14381,FIFA Street 2,2006-02-28,"FIFA Street 2 is second installment in EA's four-on-four soccer game. FIFA Street 2 will feature improved controls, many more tricks, and a new juggle mechanic. Take part in game modes, such as friendly, rule the street, and skills challenge. Choose from 20 national teams and 300-plus real-life soccer stars. There are 10 playable venues ranging from London's Westway Leisure Center to the sandy beaches of Brazil.",63,6.5
14438,P.N. 03,2003-09-09,"A colonial settlement on a distant planet goes out-of-control after a Computer Arms Management System goes haywire. Enter Vanessa Schneider, a freelance mercenary and robot killer with a grudge to settle in this action game. But will Vanessa's dark past collide with her ultimate mission? Find out as you guide her through futuristic environments, performing stylish spin moves, devastating combos, and powerful attacks. Remember to collect power-ups before you battle the game's robots, machines, megaweapons, and transforming enemies.",63,8.5
14466,The Incredibles,2004-10-31,"Superstrength, superspeed, invisibility, and elasticity are all the powers you have to combat evil in The Incredibles. You'll need them, because your enemies throw bombs, bullets, and lasers at you. Based on the movie from Pixar, The Incredibles tells the story of a family of undercover superheroes that is trying to live a quiet, suburban life but is forced back into action to save the world. As the film's main characters, you must fight, race, and solve puzzles in more than 18 action-packed levels.",63,6.3
14526,Teen Titans,2006-05-24,"Teen Titans, the popular TV show and DC comic, crosses to another medium as the five main characters undertake a video game-based adventure. All five main characters--Robin, Starfire, Beast Boy, Cyborg, and Raven--use their powers to battle against the team's main archvillains. This action game lets you switch characters on the fly, which lets you maximize their unique abilities throughout each level.",63,7.1
14535,Chaos Field,2005-12-20,"Chaos Field is O3 Entertainment's adaptation of the space-shooting Japanese arcade hit of the same name. The game includes three characters, five levels, and multiple weapons to assist you in your 2D shootouts. During gameplay, you can shoot other bullets as they fly at you and use an energy field to absorb the ones you miss. The game will be released on the Dreamcast in Japan.",63,5
14554,Rally Championship,2003-07-30,"If you've been waiting for a great rally racing game to come to the GameCube, keep waiting. Rally Championship isn't it.",63,
14555,Evolution Worlds,2002-12-02,"Deep within the ruins of Evolutia, an ancient technology waits to be uncovered. Two heroes set out to find this power, only to fall into an epic struggle with the Army of the 8th Empire.",63,8.3
14584,Spyro: A Hero's Tail,2004-11-03,"Spyro must save the Dragon Realms from the Evil Red Dragon who has planted light-sapping Dark Gems all over the Dragon Realms in an attempt to control the world. With the help of his allies, Spyro must seek out and destroy all of the Dark Gems to return the land back to normal and to save the Dragon Realms from the evil dragon's tyrannical control. Guide Spyro as he uses his new dragon powers, abilities, and gadgets in lush environments rife with new villains.",62,7.1
14586,Harry Potter and the Sorcerer's Stone,2003-12-09,"Leave the nonmagical world behind and enroll in Hogwarts School of Witchcraft and Wizardry in Harry Potter and The Sorcerer's Stone. As Harry Potter, you will hone your magical skills and advance through three terms of study during Harry's first year at Hogwarts. Each term will challenge you to meet a number of objectives, such as collecting and mixing potions with Professor Snape or piloting a flying broom through the Forbidden Forest in search of Neville Longbottom's Remembrall. In order to pass the first year of study, players must complete over 29 different objectives, while avoiding enemies and obstacles.",62,8
14588,Finding Nemo,2003-05-12,"Dive into a thrilling underwater adventure. Based on the movie from Disney and Pixar, Finding Nemo challenges you to reunite the young clownfish Nemo with his father Marlin. You have the option to play as Marlin, Dory, or Nemo and, as you live the action of the film's storyline, you'll meet all the other memorable characters. Also, remember hilarious moments from the film through clips included in the game. The search for Nemo is on, and it's up to you to find him.",62,5.4
14634,Conflict: Desert Storm,2003-04-22,"Conflict: Desert Storm lets you lead one of the best known and most feared special operations forces in the world: the elite British SAS or the US Delta Force. Covert missions take you through hostile environments where only your expertise in stealth, tactics, and firepower will ensure the success and safety of your men. Your missions are as unpredictable as they are dangerous: from vital scud-hunting missions deep within enemy territory to highly secretive rescue and assassination operations in Baghdad itself.",62,8.1
14657,Odama,2006-04-10,"Mix all the intensity of classic pinball with the sights, sounds, and savagery of war and what do you get? Odama -- the first pinball game that throws you into the midst of mighty clashes between armies on boards laid out like chaotic battlefields. Use the flippers to send Odama -- the giant pinball -- to destroy the enemy's barracks and turrets. Hit enemy soldiers with the ball to make them join your ranks, dam rivers, liberate extra flippers, and clear the way to the enemy's gate.",62,8
14758,Viewtiful Joe: Red Hot Rumble,2005-11-08,Captain Blue is casting for the lead in his new action movie and the competition is RED HOT! Fight head-to-head against your friends - whoever is the most kick-butt lands the starring role!,62,6.9
14795,Resident Evil 3: Nemesis,2003-01-15,"A month and a half have passed since the mansion lab incident and now the secrets come back to haunt you in Resident Evil 3: Nemesis. Join Jill Valentine in her attempt to escape a nightmarish city in ruins. Around every corner lurk hordes of flesh-eating zombies, hideous mutants, and a relentless new nemesis. You'll soon rely on cunning and brute force to stay alive. The Resident Evil series has taken a horrifying turn, unveiling new layers in the Umbrella Corporation's devious activities.",62,8.7
14807,Namco Museum,2002-10-09,"All your favorite Namco classics are now in one package. Namco Museum 1 includes Pac-Man, Ms. Pac-Man, Galaga, Galaxian, Dig Dug, and Pole Position. But the fun doesn't stop there, since Namco has added all new arrangement modes plus other hidden games. Whether it's eating ghosts, shooting aliens, digging a hole, or racing toward the finish line, the addictive gameplay of Namco Museum has proven it can stand the test of time.",62,8.1
14841,Auto Modellista,2003-09-30,"Handle the road like a pro with your own customizable racing machine or your choice of more than 60 top-of-the-line models. Race vehicles from manufacturers, including Toyota, Nissan, Honda, Subaru, and Mitsubishi, against up to eight drivers online or up to two drivers in split-screen mode. You'll tear past spectators, maneuver your way through tight mountain passes, and round each corner of the race track in your dream car at lightning speeds.",62,5.8
14842,X2: Wolverine's Revenge,2003-04-14,"X-Men's most dangerous weapon is out for vengeance. In X2 Wolverine's Revenge, you play as Wolverine as he rushes to find the antidote to a virus that was implanted into his body. Unsheathe your razor-sharp claws, unleash lethal combo attacks, and use accelerated healing powers as you tear into intense action and stealth scenarios. Face off with Sabretooth, Wendigo, Juggernaut, and Magneto, while Professor X and Beast help you search for a cure. As Wolverine, you can become the ultimate fighting machine.",62,6.4
14873,Tube Slider,2003-04-17,"Sometime in the middle of the 21st century, shortly following the development of hydrogen-based power, a global treaty prohibiting the use of fossil fuels was passed which banned all motor sports. Although the world established a culture of peace and environmental preservation, people wanted a sport that would whet their appetites for speed and competition... Get your adrenaline fix as you race at incredible speeds in hover vehicles that slide through futuristic gravity-defying race courses enclosed in tubes... reaching speeds over 1,000 miles per hour! The future of championship formula racing is faster, sleeker, and more dangerous. You may be able to finish a race, but can you take home a championship?",62,
14914,Resident Evil Code: Veronica X,2003-12-03,"Experience another terrifying chapter in the Resident Evil series with Resident Evil: Code Veronica X. After narrowly surviving the horrific onslaught in Raccoon City, Claire Redfield now seeks clues in search of her missing brother, Chris. Join Claire as she uncovers the insidious activities of the Umbrella Corporation. Avoid or eliminate flesh-eating zombies and horrific beasts. Use a variety weapons, items, and clues scattered around Raccoon City to help you survive the nightmare and make sure the virus doesn't spread any farther.",62,8.3
14916,Crash Bandicoot: The Wrath of Cortex,2002-09-17,"The fifth Crash adventure features engaging gameplay, quirky characters and exotic locales. Still smarting from his last defeat, Dr. Neo Cortex has developed a new diabolical plan to steal ancient crystals and unleash destructive gods on Crash and the planet Earth. With Crash and his sister Coco, it's now up to you to find and return all the crystals across dangerous levels, including a volcanic island, a Japanese village, and the jungles of Africa. You'll find many ways to move around, whether you maneuver a Jeep, fly a hang glider, or pilot a Crash-Mech. But don't marvel too long at the new inventions, because you might find yourself in a heap of destruction.",62,6.9
15083,The Hobbit,2003-11-11,"Set in the mythical world of Middle-earth, The Hobbit is an introductory tale to the Lord of the Rings trilogy. You control Bilbo Baggins as he travels from his peaceful Hobbit hole in Hobbiton into the dark and harrowing Mirkwood forest and finally to the Lonely Mountain, the home of Smaug the dragon. During your journey, you will acquire items, knowledge, and courage to face the most terrifying of enemies. Come face-to-face with elves, trolls, orcs, spiders, and wolves. It's up to you to lead the quest that started it all.",61,8.1
15086,Whirl Tour,2002-11-12,"'Flipside' is giving a stunning performance at Castle Coliseum. Suddenly in the middle of the band's finale an audible power surge occurs, and lightning strikes each of the 6 band members. One after another they are vacuumed into the sky. The band's roadie shakes his head in disbelief. ""I have to find them!!!"" He jumps through a color-shifting portal, grabs his scooter and rides off to search for his idols.",61,7.2
15088,Disney's Tarzan Untamed,2001-11-17,"As the primal action hero Tarzan, use extreme athletic skills through the dense jungle to rescue your animal friends from vicious poachers.",61,7
15158,Disney's Donald Duck: Goin' Quackers,2002-03-25,"Donald runs amuck, gets hyper and goes berserk across 22 levels in this hilarious quest to rescue Daisy.",61,3.4
15185,Fantastic 4,2005-06-27,"Based on the 2005 movie of the same name, Fantastic Four lets you control the team of superheroes known as the Fantastic 4. Each character possesses a unique set of abilities that you can use and combine in the hunt for Doctor Doom. The game includes single-player, cooperative, and two-player versus modes.",61,4
15237,Kirby Air Ride,2003-10-13,"Prepare for fast and furious racing action as Kirby hits Warpstar speed. Use simple controls to race and battle your friends in one of three hectic game modes. In Air Ride mode, you'll race to the finish line against your friends or computer-controlled competition. Top Ride mode lets up to four players race to the finish line using wild items like buzz saws, drills, and freeze fans to pester the competition. In City Trial mode, you'll race around a gigantic fantasy city in a quest to build the ideal machine to use in a random challenge that occurs after a set time limit. Don't let Kirby's cuteness fool you--Kirby Air Ride is crawling with tough challenges suitable for players of all ages.",61,8.1
15253,Darkened Skye,2002-11-16,"YOU ARE SKYE OF LYNLORA, RECRUITED AS HERO #1 IN THE BATTLE AGAINST EVIL. Wield Powerful Magic Solve Ancient Mysteries Save the World",61,6.9
15290,Spawn: Armageddon,2003-11-21,"Spawn: Armageddon, based on Todd McFarlane's creation, is a 3-D action adventure that gives players access to all of Spawn's distinctive abilities, superhuman strength, arsenal of weaponry, Hell Powers, and, of course, his living symbiotic costume. Caught between the battle of Good vs. Evil, he struggles to break free from the controlling influences of Heaven and Hell.",61,7.3
15309,Namco Museum 50th Anniversary,2005-08-30,"Namco celebrates their 50th anniversary by packaging 14 of their best classic arcade games onto one disc. The interface lets you browse a virtual game hall with each game shown in its original arcade cabinet. The games included in this collection are: Pac-Man, Ms. Pac-Man, Galaga, Galaxian, Dig Dug, Pole Position, Pole Position II, Rolling Thunder, Rally X, Bosconian, Dragon Spirit, Sky Kid, Xevious, and Mappy.",60,7.8
15321,Ribbit King,2004-06-08,"In Ribbit King, the fate of the planet rests on your ability to get frogs into holes. This is the game of Frolf, and, as Scooter, you must play it across 20 different courses on five different worlds. Power supplies are running out, and to save them, you must win the coveted Super Ribbinite. Choose from 13 odd characters and more than 10 frogs to collect items and points through Frolfing matches. Become the Frolfing Champion in Story mode or Versus mode, which supports up to four players.",60,7.3
15331,Ratatouille,2007-06-26,"Players relive the film's most thrilling moments as they assume the role of Remy, a young rat who dreams of becoming a great French chef, despite the obvious problem of being a rat. From the underground sewers to the bustling streets of Paris, players dash, glide and slide through 6 action-packed worlds filled with dangerous enemies, heists and perilous missions. Players can go head-to-head with their friends in multiplayer mini-games or navigate their way through a sensational rat race that turns the culinary world of Paris upside down.",60,5.5
15337,Rave Master,2005-03-08,"Now you can fight as your favorite character from Rave Master, the animated series. In Rave Master, you must defeat your enemies with your arsenal of weapons, attack combos, and special moves. The game features single-player challenges, a story edit mode, and a four-player versus mode. Immerse yourself in the visual and audio effects taken directly from the animated show.",60,6.3
15365,King Arthur,2004-11-18,"Live the true story behind the epic legend of King Arthur and the Knights of the Round Table. Based on the King Arthur movie from producer Jerry Bruckheimer, the King Arthur game lets you take control of one of five heroes, including Arthur, Lancelot, and Guinevere, each with unique weapons and skills. With three modes of battle, motion-captured fighting sequences and moves, and cutscenes from the film, King Arthur re-creates the events of this legendary tale.",60,
15366,Monster House,2006-07-18,"Oh no! Old man Nebbercracker's house is eating anything and anyone who gets near it, and Halloween is almost here! So grab your Water Blaster, gather up your courage, and get ready to explore the Monster House to find out its secrets.",60,
15367,GoldenEye: Rogue Agent,2004-11-22,"Why save the world when you can rule it? GoldenEye: Rogue Agent transports you to the dark side of the Bond universe as an aspiring 00 agent dismissed from MI6 for reckless brutality. You can customize and upgrade your villain persona and wreak havoc as you make your unrelenting rise through the ranks. You'll cross paths with such legendary allies and enemies as Oddjob, Scaramanga, Xenia Onatopp, and Pussy Galore on worldwide missions of vengeance and demolition. GoldenEye: Rogue Agent integrates single-player and multiplayer split-screen across all game modes.",60,6.6
15450,BMX XXX,2002-11-24,"BMX XXX combines outrageous Hollywood humor and characters, beautiful women from New York's famous Scores club, incredible arcade action, and a dynamic soundtrack from current recording artists into one interactive entertainment experience. Laced with mature content, the game features Create-a-Rider mode, over 2,000 different tricks, eight massive levels, and a split-screen multiplayer mode for up to four players. The version for the PlayStation 2 has been edited to eliminate the topless nudity, while versions for the Xbox and the Nintendo GameCube do contain nudity.",60,4.4
15514,Avatar: The Last Airbender,2006-10-10,Water. Earth. Fire. Air. Are you ready to face your destiny? Journey through 6 exotic locations filled with adventure to help Aang fulfill his destiny to master the bending arts and become the Avatar - for only the Avatar can stop the ruthless might of the Fire Nation! Defeat hordes of bizarre enemies and perform noble deeds on your quest to save the world.,60,6.4
15544,Gauntlet: Dark Legacy,2002-03-06,"Gauntlet's hack-and-slash gameplay continues in Gauntlet: Dark Legacy. You and up to three of your friends must work as a team through eight dangerous worlds. As one of eight different characters, you'll vanquish creatures, evade traps, and search for treasure. Character-based power attacks, magic potions, new power-ups, and combination moves add to the mayhem. The game save system allows players to transfer evolving characters from their own machine to a friend's to take on the dungeon together.",60,8.6
15549,Rayman Arena,2002-09-24,"Rayman Arena puts you in a competitive crash course. As any member of the cast of Rayman 2, you must smoke the competition on challenging race courses or incite a firefight in the battle arena. Take risks, use tricks, and trip up opponents as you sprint, slide, climb, and helicopter through 12 courses in an all-out rush for the checkered flag. Each of the gladiator-style arenas features its own set of power-ups, traps, and special ammo. You can also compete with up to four players in multiplayer action.",60,7.7
15587,Resident Evil 2,2003-01-16,"Ready or not, the terror of Resident Evil 2 is here. In chapter one, the case of the disastrous T-virus outbreak--a mutagenic toxin designed for biological weapons--was eventually closed but the experiments were far from over. Control the destiny of Leon Kennedy or Claire Redfield as their nightmare begins when a biotech terror runs rampant in Raccoon City. Relentless zombies and hideous monsters are all out for a taste of your blood. If the suspense doesn't kill you, something else will.",59,8.7
15588,True Crime: New York City,2005-11-15,"Be a good cop or a bad cop in the streetwise action game True Crime: New York City. You can explore the authentically modeled streets of New York City as a police officer tracking down criminals and administering justice. The game features a diverse weapon set, as well as a mixed offering of fighting styles that you can use to take out those who stand in your way. In addition to combat on foot, the game features driving sequences and shootouts. Laurence Fishburne, Christopher Walken, and Mickey Rourke contribute their voice talent to the game as well.",59,8.1
15606,Samurai Jack: The Shadow of Aku,2004-03-24,"Thrust into the future by the evil Aku, a lone Samurai warrior must quickly find the time portal to the past to rescue his defenseless people. Ancestors of the displaced Samurai call him Jack and help him through four enemy-filled realms with 24 interactive levels. Samurai Jack suffers various states of damage if he fails to dodge fireballs and sword strikes, but slow-motion attacks, devastating combo moves, and sushi snacks empower the hearty warrior. From a burning village to the bustling Aku City, you'll guide Jack as he blasts through doors, finds hidden pathways, and frees caged locals, bringing him ever closer to fulfilling his great destiny--the defeat of Aku once and for all.",59,6.2
