index,name,release_date,summary,meta_score,user_review
7498,Baten Kaitos Origins,2006-09-25,"Baten Kaitos Origins takes place 20 years before the first Baten Kaitos game. It explains how the diabolical Emperor Geldoblame rose to power, and it also fills in many details about the heroes from the first title. In addition, players will learn about the origins of the world itself and why the Lost Ocean is returning. The hero, a blue-haired young man named Sagi, was sent to assassinate the Emperor but found the job had been done for him. Blamed for the death, he's now on the run with two friends - a robot named Guillo and a young woman named Milly. In the initial stages, the player's party will progress in a linear fashion, moving from one area to the next along a set path. After playing the game for a few hours, players will acquire a ship that lets them visit areas in the order of their choosing, allowing them to either pursue optional side quests or blast through the main mission as they see fit. Unlike traditional RPGs, where characters gain levels in categories such as strength and agility, the majority of leveling-up occurs by procuring better Magnus cards. There are more than 600 different Magnus cards in Baten Kaitos Origins, some of which have truly fantastical properties. Players can acquire cards in many different ways, including trading, buying, winning as spoils of war or by creating them themselves.",75,8.5
7583,Buffy the Vampire Slayer: Chaos Bleeds,2003-08-28,"Buffy the Vampire Slayer: Chaos Bleeds lets you play as six characters from the TV show--Buffy, Faith, Willow, Xander, Spike, and a friend from the past. Use each character's unique abilities to defeat an ancient evil that threatens to destroy them and their world. Set in both familiar and new locations, the game challenges you to overcome a variety of challenges. Chaos Bleeds also features several multiplayer modes, including Domination, Last Man Standing, Bunny Catcher, and Slayer Challenge.",75,8.4
7585,Sonic Mega Collection,2002-11-10,"Sonic has appeared in many games in the last decade, and now you can relive seven of them from Sonic Mega Collection. This compilation includes the first three Sonic the Hedgehog titles, plus Sonic & Knuckles, Sonic 3D Flickies' Island, Sonic the Hedgehog Spinball, and Dr. Robotnik's Mean Bean Machine. With additional content such as character illustrations, movies, and comic-book covers, this game celebrates Sonic's long career and introduces his world to new generation of gamers.",75,8.6
7690,Bloody Roar: Primal Fury,2002-03-18,"Wage an all-out assault as one of 16 fighters, each with the ability to transform mid-fight into their alternate Hpyer-beast life-form. Fight to the finish in 2-player head-to-head and single-player modes through 10 interactive and destructible mutli-level arenas. With fast and furious arena action-fighting has never looked this good or been this brutual.",75,8.3
7720,Disney Sports Soccer,2002-11-17,"Disney Sports Soccer takes the fun of a neighborhood soccer game and adds your favorite Disney characters. In three different game modes, including a multiplayer mode, you can use magic, power-ups, and special moves to defeat your opponents. Up to four players can assume the role of Mickey Mouse, Minnie Mouse, Donald Duck, Goofy, or other Disney favorites, and they can compete in a variety of stadiums, including Eagle Summit. You can also exchange items between your Game Boy Advance and GameCube.",75,8
7790,Star Wars Jedi Knight II: Jedi Outcast,2002-11-20,"In the tradition of Jedi Knight, rebel agent Kyle Katarn returns in thrilling first-person action. Several years have passed since Kyle avenged his father's death and saved the Valley of the Jedi from Jerec and his band of Dark Jedi. When a new and menacing threat to the galaxy emerges, Kyle knows he must reclaim his past in order to save his future. You assume the role of Kyle and employ a unique mix of weapons, Force powers, and your lightsaber in both solo and multiplayer modes.",75,8.2
7881,Chibi-Robo!,2006-02-06,"The Sanderson family just got the ultimate in high-tech, house-helper technology: Chibi-Robo. In this inventive, story-driven game, players guide a miniature robot as he completes chores and clashes with enemies in his epic quest to become the highest-ranked Chibi-Robo out there. The living room can be a dangerous place when you're a robot less than a foot tall, so players will need to team up with the native toys to overcome obstacles, rack up points and keep the family happy. Normally running on battery power, Chibi-Robo needs to plug into power outlets with his built-in cord when he runs low on juice. Doing chores has never been so much fun.",75,8.7
7892,Tak 2: The Staff of Dreams,2004-10-11,"Tak must learn new Juju magic to recover the Staff of Dreams and defeat Tlaloc once and for all. Now dabbling with new abilities, Tak can create a little Juju magic of his own. As Tak, try to master three new Jujus, expanded combat capabilities, and new weapons as you battle Nightmare creatures. Interact with familiar characters from the series, along with Jibolba's brother, JB. Multiplayer ""Dinky"" games let you face off in head-to-head action with playable characters from Tak's world.",75,8.6
7905,Need for Speed Carbon,2006-10-31,"What starts in the city is settled in the canyons as Need for Speed Carbon immerses you into the world's most dangerous and adrenaline-filled form of street racing. You and your crew must race in an all-out war for the city, risking everything to take over your rivals' neighborhoods one block at a time. As the police turn up the heat, the battle ultimately shifts to Carbon Canyon, where territories and reputations can be lost on every perilous curve. Need for Speed Carbon delivers the next generation of customization giving you the power to design and tweak your crew's cars in every way using the ground-breaking new Autosculpt technology. Represent your car class, your crew, and your turf in Need for Speed Carbon, the next revolution in racing games.",75,7.9
8050,Robotech: Battlecry,2002-10-27,"The Veritech fighter--a mecha capable of fighting on land, in air, and in outer space--is the only weapon you have against the forces of the alien, Zentraedi. As the intrepid fighter pilot Jack Archer, you'll control this powerful robot through more than 40 missions. With each of the 40 Veritech fighters, you can switch from ground to hover and flight modes instantly. Battlecry's combination of fast-paced gameplay, freedom of movement, and dramatic storyline make for a unique combat experience.",74,8.5
8051,James Bond 007: Agent Under Fire,2002-03-13,"Driven by a completely new and original storyline, James Bond 007: Agent Under Fire is a first-person action game that balances furious action and stealth tactics. An evil world organization has been replacing world leaders with their more docile clones and it's up to you to put a stop to it. As Bond, you'll encounter villains and allies, both new and familiar, detailed 3D environments, and spy-packed, fast-action gameplay. And don't worry, Q will provide you with all the innovative weapons, sophisticated spy-craft, and state-of-the-art gadgets that Bond fans expect.",74,6.8
8113,Midway Arcade Treasures 2,2004-10-11,"Midway Arcade Treasures 2 brings 20 classic arcade games back to next-generation consoles. This compilation includes such favorites as Mortal Kombat 1, 2, and 3, Spy Hunter 2, Gauntlet 2, NARC, Cyber-Ball, Wizard of Wor, Primal Rage, Steel Talons, Arch Rivals, and more. Each game can provide hours of retro-gaming entertainment. Midway Arcade Treasures 2 also features a documentary on the origins of these games.",74,7.3
8117,Pac-Man World 2,2002-03-19,"Pac-Man is on a brand new adventure and once again dealing with the pesky Ghost Gang. In Pac-Man World 2, the Ghost Gang has picked the magical fruit from an ancient tree, thereby releasing wicked evils upon Pac-Land. You must guide Pac-Man through six new lands with plenty of amusing surprises. New and improved, this Pac-Man can ice skate, rollerblade, submarine dive, and solve many exciting puzzles. With all-new moves and a zany cast of characters, your Pac-Man heroics will be pushed to its limits.",74,8.4
8154,Naruto: Clash of Ninja 2,2006-09-26,"The hit series on Cartoon Network is back for more on Nintendo GameCube! NARUTO: Clash of Ninja 2 delivers non-stop ninja style combat action for 1-4 players where gamers choose to play as one of 23 playable characters. Naruto, Sasuke, Sakura and the other ninja-in training are going beyond the classroom now and must face each other and challenging new opponents in multi-ninja battles. All-new multi-player modes will engage players in frantic simultaneous four player battles and single-player modes will offer more gameplay choices than before with survival and timed attack modes that allow players to showcase their taijutsu and special jutsu abilities. When you're a ninja, you must be prepared for anything! Believe it!",74,8.7
8194,Killer7,2005-07-07,"Killer 7 chronicles the connection between two men whose intertwined paths develop into a tale of revenge and altering personas. You play as not only one man but also as his seven other personalities in a mission to stop a wave of indiscriminate violence that's plaguing the world. Each of your personalities has unique abilities--including invisibility, extra strength, superhearing, and more--that help you defeat the evil Kun Lan and his crazy soldiers.",74,8.7
8407,The Lord of the Rings: The Third Age,2004-11-02,"In The Lord of the Rings: The Third Age, you can travel in the wake of the Fellowship while exploring your own path and periodically intersecting the major events of the film trilogy. Through both familiar and new locations, you must fight to save or destroy Middle-earth in an epic adventure. Encounter the demonic Balrog in the Mines of Moria, defend the fallen city of Osgiliath, or try to destroy Helm's Deep. These choices and many more will confront you as you align yourself with the people of Middle-earth or undertake missions on behalf of Sauron.",74,7.9
8464,Rocky,2002-11-17,"Jump into the ring as Rocky Balboa and go head-to-head against 29 tough opponents, including Apollo Creed, Clubber Lang, Ivan Drago, and Tommy Gunn. Mickey and company train you from the streets of Philadelphia to the world heavyweight championship bout. Master Rocky's powerful punch combos and fast flurries. Practices your skills in Sparring mode and then test them out in the Knockout Tournament against 15 other players. Based on the movie trilogy, Rocky tests your dedication, skill, and heart through various gameplay modes.",74,
8561,Call of Duty: Finest Hour,2004-11-16,"You've been called to defend your Allied country against the Axis foes. In Call of Duty: Finest Hour, you must fight as part of a squad through the chaos of battle. Whether you play as American, British, or Russian forces, you'll discover the hardships that every unsung hero had to face during World War II. The game also features authentic weapons, vehicles, environments, combat missions, and the real sounds of war. Finally, the cinematic battlefield conflicts come to life on your gaming console.",74,7.9
8673,XIII,2003-11-24,"The president of the United States of America has been assassinated and you are the prime suspect. In XIII, you must unravel a conspiracy that left your memory erased, the President dead, and a bullet wound in your head. Evade assailants eager to end your life or use them as human shields. Select from a deadly arsenal of weapons including silent crossbows, furious automatic weapons, and ashtrays. Face off against other players in multiplayer modes such as Barfight or go co-op in Cover Me mode. Uncover both your shadowy past and America's darkest corridors of power.",73,7.7
8684,1080: Avalanche,2003-12-01,"Danger is the name of the game in 1080- Avalanche. Huge air, massive drop-offs, deep powder, and the nastiest tricks come together in one package. It's a frantic race to the bottom of the mountain, so stick tricks on the way down to increase your rider's speed and power. Keep your eyes peeled for shortcuts, rockslides, natural wildlife, dizzying drops, and sudden weather changes. The successor to the Nintendo 64 version of the game, 1080- Avalanche offers a wide variety of play modes, challenges, and secrets to keep you on your toes.",73,8
8691,The Urbz: Sims in the City,2004-11-09,"The Sims have moved to the City where there's always action and where reputation means everything. In the Urbz: Sims in the City, you can go to work at such locations as the Sushi Bar, Chop Shop, or Bootleg Fireworks, Inc. Success at work brings promotions, access to new power socials, and gear to influence your new lifestyle. Flaunt your attitude by styling your Urbz, and then cross the velvet ropes of an uptown night club, or explore the subway to earn new skills and items.",73,8.4
8753,Pokemon Colosseum,2004-03-22,"Pokmon fans can now battle their favorite Pokmon on the grand stage. Starring a brand new leading character, Pokmon, Colosseum offers a story mode that pits you against tough trainers who routinely catch damaged Pokmon. In Battle mode, you can use the Game Boy Advance cable to send your team from your Pokmon Ruby or Pokmon Sapphire Game Pak to your Gamecube, then witness the true potential of your team. Rescue Pokmon and watch them come to life in spectacular Colosseum battles.",73,8
8788,The SpongeBob SquarePants Movie,2004-10-27,"Someone has stolen King Neptune's crown, and Mr. Krabs is the main suspect. Despite having been passed over for a promotion by Mr. Krabs, SpongeBob and his faithful (but dimwitted) friend Patrick volunteer to make the perilous journey to Shell City to retrieve the crown and save Mr. Krabs' life. Play as SpongeBob or Patrick as they interact with characters from the movie, earn ""manliness"" points to gain power-ups, and explore vast environments in the ""Patty Wagon.""",73,7.7
8822,The Sims 2,2005-10-24,"In The Sims 2, you can control your Sims over an entire lifetime for the first time. With the addition of genetics, the game lets your Sims pass their DNA down through generations. Every life choice you make has a relevant and dramatic effect on the lifetime of your Sim. Now it's up to you to take your Sims from the cradle to the grave, while fulfilling their dreams and pushing them to extremes.",73,7.8
8900,Conflict: Desert Storm II - Back to Baghdad,2004-01-07,"At the height of the 1991 Gulf War, 300 klicks into the heart of Iraq, you must command your squad of Special Forces operatives to strike at Iraq's evil dictator and his fascist regime. Armed with an authentic arsenal of high-tech weapons and vehicles, your squad will face impossible odds in this battle against tyranny. Only strategy and skill will ensure your survival through frantic firefights, gut-wrenching vehicular combat, and gripping stealth operations. ""The Mother of All Battles"" is coming to your console in Conflict: Desert Storm II--Back to Baghdad.",73,8.5
8903,Star Wars: The Clone Wars,2002-10-28,"Star Wars: The Clone Wars begins where Star Wars Episode II: Attack of the Clones ends. As Jedi Anakin Skywalker, Mace Windu, or Obi-Wan Kenobi, you lead the Republic Army in the greatest battles of the epic Clone Wars. Your mission is to stop the Separatists from reassembling an ancient Sith weapon of mass annihilation. Then battle for survival in a variety of multiplayer games with up to four players, with Deathmatch, King-of-the-Hill, and even strategic Conquest games. And engage over 30 unique combat units as you wage war across six worlds in the galaxy's most unforgettable conflict.",73,7.4
8984,Pitfall: The Lost Expedition,2004-02-18,"Delving deep in the Peruvian Jungle, you assume the role of Pitfall Harry--a fearless, rough-and-ready treasure seeker who battles evil using his athletic ability and a knapsack filled with adventure gear. Your mission: Race against a rival explorer to find hidden treasures, which could spell doom for you and your friends if they fall into the wrong hands. The game challenges you to explore an obstacle-filled world featuring over 50 perilous levels, including lush rainforests, creature-ridden caves and vast glacial mountains. You'll be swinging on vines, avoiding crocodiles and dodging rolling logs as you unearth artifacts and use your cunning to defeat dangerous foes.",73,8.8
8988,BloodRayne,2002-10-15,"BloodRayne is a killing machine. The Brimstone Society calls upon this half-vampire, half-human agent to take on two missions in the years between the world wars. At the root of these missions is one man who searches for powerful occult artifacts that would bring Germany into a new age of domination. As BloodRayne, you must stop this man's elite Nazi army from releasing terrorizing creatures onto the world. With melee attacks, weapons, and bloodsucking abilities, your enemies won't stand a chance.",73,8.2
9025,Sonic Adventure 2 Battle,2002-02-11,"Sonic and company are back and better than ever in Sonic Adventure 2: Battle. Dr. Eggman is causing trouble once again, and it's up to Sonic, Tails, and Knuckles to stop him. Experience faster action, all-new two-player games, and a branching storyline that lets you choose to save the world as the Hero side, or conquer it as the Dark side. In the single-player mode, you'll go through more than 30 unique stages, which include a forgotten pyramid, an abandoned military base, and a giant space station. And then there's the expanded two-player mode, which features 12 playable characters competing in new head-to-head games.",73,8.5
9222,Godzilla: Destroy All Monsters Melee,2002-10-08,"Legendary monsters battle among Earth's cities to determine the planet's fate. In Godzilla: Destroy All Monsters Melee, you can play as Godzilla or any of his longtime rivals as they fight hand-to-hand, at close range, and with special moves. Each massive beast has different physical attributes and special projectile weapons. You'll fight in cities such as Tokyo and San Francisco--all featuring real building destruction and physics. For multiplayer fighting mayhem, you can bring three of your friends into the battle.",73,7.4
9171,Spartan: Total Warrior,2005-10-27,"You can battle hundreds of ancient warriors, both historical and mythical, in Spartan: Total Warrior. As ""The Spartan"" you can upgrade your weapons and armor and gain the favor of the gods as you fight through epic battles against units ranging from Roman soldiers to skeleton warriors. Levels feature a variety of objectives, such as escorting, capturing, destruction, discovery, and survival.",73,8.1
9350,Midway Arcade Treasures,2003-12-18,"Midway Arcade Treasures is jam-packed with over 20 classic arcade games. Take a trip down memory lane as you relive the fast-paced action of SpyHunter, the cooperative multiplayer of Gauntlet, the space age adventure of Defender, the charm of Paperboy, the destructive monsters of Rampage, and the dueling combat of Joust. While you rest your fingers, check out the DVD content with game histories, creator interviews, and top secrets from videogaming's early days.",72,8.1
9368,Puyo Pop Fever,2004-07-20,"From the popular Japanese puzzle game Puyo Pop comes Puyo Pop Fever, designed for a new generation of console gamers. Simple yet challenging, the game features both single-player and multiplayer options. The additional fever mode adds a different twist to the gameplay, providing the opportunity to create a string of chain reactions that can annihilate your opponent. Puyo Pop Fever mixes both 2D and 3D elements, and as the action speeds up, you'll see more special effects combined with ""anime"" graphics.",72,8.4
9512,NFL Blitz 20-03,2002-08-12,"NFL Blitz returns to the field with it unique brand of hard hits, wild moves, and flying tackles. In this year's installment, you can create your own player and take on the best the NFL has to offer. The game features all your favorite teams, players, and stadiums--all of which are brought to life with more than 1,500 new animations. Take control of real players with ripped physiques and real faces, or have fun with fantasy players in imagined locales.",72,7.8
9575,Sonic Heroes,2004-01-05,"Sonic Heroes brings the Sonic series to the PS2 and Xbox for the first time. Dr. Eggman is causing havoc again and it's up to you to maneuver a team of three Sonic characters through massive levels. All 12 characters--divided into Team Sonic, Team Dark, Team Rose and Team Chaotix--have their own unique strengths, so choose your teams wisely. Find the best combination to complete missions full of enemies, puzzles, and huge environments. No matter what team you choose, the only direction is forward and the only way to get there is fast.",72,7.9
9608,Tom Clancy's Rainbow Six: Lockdown,2005-09-27,"The next installment in the Rainbow Six series introduces a new single-player experience featuring advanced equipment and new storylines. This time, you can play as either Ding Chavez (the leader of Team Rainbow) or Dieter Weber (a sniper in charge of covering his team's movement). You must lead your counterterrorist unit into unfamiliar territory to battle a bioterrorist threat. Rainbow Six 3 also features online multiplayer modes, including the PS2-exclusive rivalry mode and the Xbox-exclusive career mode.",72,7.8
9668,Naruto: Clash of Ninja,2006-03-07,"Naruto: Clash of Ninja is a 3D fighting game based on the Japanese manga, Naruto. Take control of your favorite Naruto characters, including Naruto, Sasuke, Sakura, and more as you battle it out to determine who the greatest ninja is. Cel-shaded graphics parallel the style set forth in the cartoon, while special character-specific moves add to the feeling of authenticity.",72,7.8
9673,Summoner: A Goddess Reborn,2003-01-31,"As the Queen of Halassar, your fate is written in the Book of the Prophets as the savior of all creation. Millions adore you as the goddess reborn, yet enemies surround you. You must fulfill the prophecy and become the goddess Laharah. But the path you follow remains a mystery that takes the Queen and her companions to the far-flung corners of the world and beyond. To save your people, you must learn to summon godlike powers to let your destiny unfold.",72,8.2
9675,Swingerz Golf,2002-10-23,"Grab your clubs and hit the links in Swingerz Golf. You'll tee up on six courses featuring diverse terrains, from a cactus-filled desert to a classic English course. Play as or against 14 offbeat golfers, each with distinct personalities and golfing abilities. You can battle three of your friends in various gameplay modes, including Tournament, Stroke, Match, and Short Course. With challenging weather conditions, minigames, and intense tournaments, Swingerz Golf gives you a realistic and fun golfing experience.",72,7.3
9778,F1 2002,2002-06-22,"Kick off a brand-new season of racing with all the speed, glamour, and rivalry of Formula One. Officially licensed from the Formula One Administration Limited, F1 2002 features real drivers, teams, cars, and tracks from the 2002 FIA Formula One World Championship. Join new teams--Toyota and Renault--and complete all-new challenges that test your driving skills. The higher you place in each race, the more points you receive, and the closer you are to the Constructor's Cup.",72,7.8
9780,Lost Kingdoms,2002-05-27,"A dark mysterious force has taken over the five Kingdoms of Argwyll, and only one person can solve the mystery and save the world--you, as Princess Katia. Now you must travel through the kingdom and explore over two dozen unique 3D worlds filled with graveyards, forests, mountains, and fortresses. Interact with characters, uncover secret areas, and unravel the mystery of the evil forces. During your adventures, you can summon over 100 guardian creatures to help battle hordes of monsters. Make it a solo mission or go head-to-head with friends in two-player Versus mode.",72,8.2
11161,Shrek SuperSlam,2005-10-25,"You can battle characters from the Shrek movies in Shrek SuperSlam. The game lets you play as one of 20 characters, such as the heroic Shrek or villainous Prince Charming. Use weapons, potions, or a character's signature special move to fight through 16 fully-destructible arenas. Then, battle with up to four of your friends or play through more than 30 minigames.",70,6
10082,Cubivore: Survival of the Fittest,2002-11-05,"The premise of the game is simple: Eat or be eaten. In Cubivore, you'll assume the role of an animal in its early stages of development. From the moment the game begins, your creature is on its own to fend for its life. As your animal instincts take over, you will boldly traverse hostile environments, savagely stalking your prey and asserting your place in the animal chain of power. Explore a number of different environments while consuming other animals in order to evolve into one of 100 possible creature combinations. Ultimately, the goal is to become powerful enough to topple the alpha creature and earn your rightful place at the top of the food chain.",71,8.1
10085,NBA Courtside 2002,2002-01-13,"Despite the fact that it's a solid first-year effort, Courtside 2002 isn't without its flaws and is generally a step behind more seasoned competing products.",71,7.3
10096,Mario Party 6,2004-12-06,"Mario Party 6 offers a new batch of games that require both your fingers and your voice. In this installment in the Mario Party series, you can use the included microphone controller to talk your way to victory. More than 80 minigames are included. You can play as Mario, Bowser, or other characters from the Mushroom Kingdom. New characters appear on the board depending on what time of day it is. The game supports up to four players.",71,8
